{
  "schemaVersion": 1,
  "runtimePolicy": {
    "maxGoRuntimesPerProcess": 1,
    "allowedProductionEngine": "xray"
  },
  "productionEngines": [
    "xray"
  ],
  "candidates": {
    "xray": {
      "enabled": true,
      "source": "https://github.com/XTLS/libXray",
      "version": "v26.9.9",
      "commit": "50b95979f5db551bd273165cf469e5daaf791341",
      "sourceArchiveSha256": "070a5b573f5a907d31dc23064c89a8cac2cbf9a8baf7df64c42b9cac78b50d4b",
      "artifact": "LibXray.xcframework.zip",
      "sha256": "8c9eadede96413189dbc6587056790e8de108657968165faf3adbe98ee3f2891",
      "goVersion": "go1.27.1",
      "toolchain": "go1.27.1 darwin/amd64 + gomobile v0.0.0-20260908204917-8b95e45f8d3e + Xcode 26.3",
      "architectures": [
        "arm64",
        "x86_64"
      ],
      "buildFlags": [
        "-trimpath",
        "-ldflags=-buildid=",
        "-iosversion 15.0"
      ],
      "linkedFrameworks": [
        "CoreFoundation.framework",
        "Foundation.framework",
        "Security.framework",
        "libresolv.9.dylib"
      ],
      "approval": "approved",
      "license": "MIT"
    },
    "sing-box": {
      "enabled": false,
      "source": "https://github.com/SagerNet/sing-box",
      "version": null,
      "commit": null,
      "sourceArchiveSha256": null,
      "artifact": null,
      "sha256": null,
      "goVersion": null,
      "toolchain": null,
      "architectures": [],
      "buildFlags": [],
      "linkedFrameworks": [],
      "approval": "pending",
      "license": "GPL-3.0-or-later"
    }
  }
}
